{
  "id": "secret-backup-codec-v1",
  "provenance": {
    "source": "SNIF v1 Draft 2 sections 3.1, 6.1, 7 and 10",
    "derivation": "The valid account and mnemonic envelopes are the deterministic RFC 8949 CBOR and password-v1 values from codec-structural-matrix-v1. Header tamper changes the final salt byte, tag tamper changes the final encrypted-payload byte, and zlib cases change only compression to zlib; each resulting envelope was deterministically CBOR-encoded."
  },
  "constants": {
    "password": "SNIF password-v1 fixture",
    "wrongPassword": "SNIF password-v1 wrong fixture",
    "passwordFixture": "password-v1-fixed-v1"
  },
  "cases": [
    {
      "id": "account-valid",
      "input": {
        "envelopeCbor": "A86474797065676163636F756E7465636861696E636E656D676E6574776F726BA16269641868677061796C6F6164588DF64D0A5E7B9A76F7BC2ABD6CB2F2FB3EAE38B6BE8062590C0BB731ABB991C73E0859342CBDEDF4A6C5B92F57E27F7CF9D7F3714D76F6B96541DFF61DF249AE9ECC3A83E95F96E018D15BF747F13DB819CF4A5F7305C972A1C7629EE54877B0EFF4A12DFBFC414786CDF82E83CCC2A3C4EC936E28694CD69150861A62CC56CBEF75B58E465AA58773DDF8FDF1836776657273696F6E016870726F746F636F6C64736E69666A656E6372797074696F6EA36473616C7450000102030405060708090A0B0C0D0E0F656E6F6E63654C101112131415161718191A1B69616C676F726974686D6B70617373776F72642D76316B636F6D7072657373696F6E646E6F6E65",
        "password": "normal"
      },
      "expected": {
        "payloadCbor": "A36761646472657373581968639B5DD5B49506D6C96B51B3FF565A98512DBBDB8A97808B697075626C69634B657958207B80BE99D38ED9BB7B33C3FE1C3087683BDEADF49AB664A08BE4215A53CE06EB6A707269766174654B65795820F532362ED9F59309EB1413027F1F742A07262C95B0257A97D3EF7FD95B51E77E"
      }
    },
    {
      "id": "mnemonic-valid",
      "input": {
        "envelopeCbor": "A86474797065686D6E656D6F6E696365636861696E636E656D676E6574776F726BA16269641868677061796C6F616458E1F14C1859778D7EE1AA10CD74E250CE877BC3D71D286E6DD8918F0C5F81CF148DEFA0D1CABBF3E8A7D14B3A79EF6F47B5C953BABAC3170CBA1A88508082104793D7894B6FB759A4DB35D1A26FCD9F9E95C05458731DCD26B6E9668B9D09EEF0BCBB1CA14890D832E6AAA7509382B7E09B0A033E3C97EE4C8BA9BE27E0C011024CCA7E7E04BD4C8D4FDAD88F4B7C9794CB37D2342F1C0EF9587D5DF1CC57BF7AAB1B0CF0C84D8D41E292C0EBF00757D4BA2B56FD9869D3548D66E38B121E05132D8AEC3118F4E5678895AF90755620A12355B86F248C66EEFDCD81476071AB2928EE6776657273696F6E016870726F746F636F6C64736E69666A656E6372797074696F6EA36473616C7450000102030405060708090A0B0C0D0E0F656E6F6E63654C101112131415161718191A1B69616C676F726974686D6B70617373776F72642D76316B636F6D7072657373696F6E646E6F6E65",
        "password": "normal"
      },
      "expected": {
        "payloadCbor": "A466736368656D65656269703339686C616E677561676567656E676C697368686D6E656D6F6E6963789B76656869636C6520756E666F6C64206465636C696E65206D6572727920636F6E74726F6C2067656E75696E65207265616C20616C7265616479206572617365206164647265737320756E6971756520636C65726B20686176652072696365206D6F746F72207370696B652068756D616E206F776E2061747461636B207472696D20676C6F6F6D20696E6368207061796D656E74206368726F6E69636A7061737370687261736560"
      }
    },
    {
      "id": "account-wrong-password",
      "input": {
        "envelopeCbor": "A86474797065676163636F756E7465636861696E636E656D676E6574776F726BA16269641868677061796C6F6164588DF64D0A5E7B9A76F7BC2ABD6CB2F2FB3EAE38B6BE8062590C0BB731ABB991C73E0859342CBDEDF4A6C5B92F57E27F7CF9D7F3714D76F6B96541DFF61DF249AE9ECC3A83E95F96E018D15BF747F13DB819CF4A5F7305C972A1C7629EE54877B0EFF4A12DFBFC414786CDF82E83CCC2A3C4EC936E28694CD69150861A62CC56CBEF75B58E465AA58773DDF8FDF1836776657273696F6E016870726F746F636F6C64736E69666A656E6372797074696F6EA36473616C7450000102030405060708090A0B0C0D0E0F656E6F6E63654C101112131415161718191A1B69616C676F726974686D6B70617373776F72642D76316B636F6D7072657373696F6E646E6F6E65",
        "password": "wrong"
      },
      "expected": { "error": "decryption-failed" }
    },
    {
      "id": "mnemonic-wrong-password",
      "input": {
        "envelopeCbor": "A86474797065686D6E656D6F6E696365636861696E636E656D676E6574776F726BA16269641868677061796C6F616458E1F14C1859778D7EE1AA10CD74E250CE877BC3D71D286E6DD8918F0C5F81CF148DEFA0D1CABBF3E8A7D14B3A79EF6F47B5C953BABAC3170CBA1A88508082104793D7894B6FB759A4DB35D1A26FCD9F9E95C05458731DCD26B6E9668B9D09EEF0BCBB1CA14890D832E6AAA7509382B7E09B0A033E3C97EE4C8BA9BE27E0C011024CCA7E7E04BD4C8D4FDAD88F4B7C9794CB37D2342F1C0EF9587D5DF1CC57BF7AAB1B0CF0C84D8D41E292C0EBF00757D4BA2B56FD9869D3548D66E38B121E05132D8AEC3118F4E5678895AF90755620A12355B86F248C66EEFDCD81476071AB2928EE6776657273696F6E016870726F746F636F6C64736E69666A656E6372797074696F6EA36473616C7450000102030405060708090A0B0C0D0E0F656E6F6E63654C101112131415161718191A1B69616C676F726974686D6B70617373776F72642D76316B636F6D7072657373696F6E646E6F6E65",
        "password": "wrong"
      },
      "expected": { "error": "decryption-failed" }
    },
    {
      "id": "account-header-tamper",
      "input": {
        "envelopeCbor": "A86474797065676163636F756E7465636861696E636E656D676E6574776F726BA16269641868677061796C6F6164588DF64D0A5E7B9A76F7BC2ABD6CB2F2FB3EAE38B6BE8062590C0BB731ABB991C73E0859342CBDEDF4A6C5B92F57E27F7CF9D7F3714D76F6B96541DFF61DF249AE9ECC3A83E95F96E018D15BF747F13DB819CF4A5F7305C972A1C7629EE54877B0EFF4A12DFBFC414786CDF82E83CCC2A3C4EC936E28694CD69150861A62CC56CBEF75B58E465AA58773DDF8FDF1836776657273696F6E016870726F746F636F6C64736E69666A656E6372797074696F6EA36473616C7450000102030405060708090A0B0C0D0E0E656E6F6E63654C101112131415161718191A1B69616C676F726974686D6B70617373776F72642D76316B636F6D7072657373696F6E646E6F6E65",
        "password": "normal"
      },
      "expected": { "error": "decryption-failed" }
    },
    {
      "id": "account-tag-tamper",
      "input": {
        "envelopeCbor": "A86474797065676163636F756E7465636861696E636E656D676E6574776F726BA16269641868677061796C6F6164588DF64D0A5E7B9A76F7BC2ABD6CB2F2FB3EAE38B6BE8062590C0BB731ABB991C73E0859342CBDEDF4A6C5B92F57E27F7CF9D7F3714D76F6B96541DFF61DF249AE9ECC3A83E95F96E018D15BF747F13DB819CF4A5F7305C972A1C7629EE54877B0EFF4A12DFBFC414786CDF82E83CCC2A3C4EC936E28694CD69150861A62CC56CBEF75B58E465AA58773DDF8FDF1826776657273696F6E016870726F746F636F6C64736E69666A656E6372797074696F6EA36473616C7450000102030405060708090A0B0C0D0E0F656E6F6E63654C101112131415161718191A1B69616C676F726974686D6B70617373776F72642D76316B636F6D7072657373696F6E646E6F6E65",
        "password": "normal"
      },
      "expected": { "error": "decryption-failed" }
    },
    {
      "id": "account-password-missing",
      "input": {
        "envelopeCbor": "A86474797065676163636F756E7465636861696E636E656D676E6574776F726BA16269641868677061796C6F616441006776657273696F6E016870726F746F636F6C64736E69666A656E6372797074696F6EA36473616C7450000102030405060708090A0B0C0D0E0F656E6F6E63654C101112131415161718191A1B69616C676F726974686D6B70617373776F72642D76316B636F6D7072657373696F6E646E6F6E65"
      },
      "expected": { "error": "password-required" }
    },
    {
      "id": "mnemonic-password-missing",
      "input": {
        "envelopeCbor": "A86474797065686D6E656D6F6E696365636861696E636E656D676E6574776F726BA16269641868677061796C6F616441006776657273696F6E016870726F746F636F6C64736E69666A656E6372797074696F6EA36473616C7450000102030405060708090A0B0C0D0E0F656E6F6E63654C101112131415161718191A1B69616C676F726974686D6B70617373776F72642D76316B636F6D7072657373696F6E646E6F6E65"
      },
      "expected": { "error": "password-required" }
    },
    {
      "id": "account-zlib",
      "input": {
        "envelopeCbor": "A86474797065676163636F756E7465636861696E636E656D676E6574776F726BA16269641868677061796C6F616441006776657273696F6E016870726F746F636F6C64736E69666A656E6372797074696F6EA36473616C7450000102030405060708090A0B0C0D0E0F656E6F6E63654C101112131415161718191A1B69616C676F726974686D6B70617373776F72642D76316B636F6D7072657373696F6E647A6C6962"
      },
      "expected": { "error": "invalid-envelope" }
    },
    {
      "id": "mnemonic-zlib",
      "input": {
        "envelopeCbor": "A86474797065686D6E656D6F6E696365636861696E636E656D676E6574776F726BA16269641868677061796C6F616441006776657273696F6E016870726F746F636F6C64736E69666A656E6372797074696F6EA36473616C7450000102030405060708090A0B0C0D0E0F656E6F6E63654C101112131415161718191A1B69616C676F726974686D6B70617373776F72642D76316B636F6D7072657373696F6E647A6C6962"
      },
      "expected": { "error": "invalid-envelope" }
    }
  ]
}
