{
  "id": "password-v1-fixed-v1",
  "provenance": {
    "source": "SNIF v1 Draft 2 section 6; RFC 9106 Argon2id and NIST SP 800-38D AES-256-GCM",
    "derivation": "Fixed inputs were evaluated independently from the SNIF codec. The reviewed values are immutable and must not be regenerated during tests."
  },
  "constants": {
    "argon2": { "memoryKiB": 65536, "iterations": 3, "parallelism": 4, "outputBytes": 32, "version": 19 },
    "password": "SNIF password-v1 fixture",
    "passwordUtf8": "534E49462070617373776F72642D76312066697874757265",
    "salt": "000102030405060708090A0B0C0D0E0F",
    "nonce": "101112131415161718191A1B"
  },
  "cases": [
    {
      "id": "valid-symbol-address",
      "input": {
        "plaintext": "A167616464726573735818988E1191A25A88142C2FB3F69787576E3DC713EFC1CE4DE9"
      },
      "expected": {
        "derivedKey": "E22BB39FB093297D88242057264400B7EC60D211CDEB262F5B4899BF0F29441F",
        "aad": "A76474797065676164647265737365636861696E6673796D626F6C676E6574776F726BA262696418987267656E65726174696F6E4861736853656564582057F7DA205008026C776CB6AED843393F04CD458E7D55817A54BEBDD4058A7D546776657273696F6E016870726F746F636F6C64736E69666A656E6372797074696F6EA36473616C7450000102030405060708090A0B0C0D0E0F656E6F6E63654C101112131415161718191A1B69616C676F726974686D6B70617373776F72642D76316B636F6D7072657373696F6E646E6F6E65",
        "ciphertext": "F44D0A5E7B9A76F7BC2ABC9C5F7837494025A44466BAFE2873B6050E2FAF93244C835D",
        "tag": "00C0F6BC7AC2622900D8DE0437638449",
        "envelopeCbor": "A86474797065676164647265737365636861696E6673796D626F6C676E6574776F726BA262696418987267656E65726174696F6E4861736853656564582057F7DA205008026C776CB6AED843393F04CD458E7D55817A54BEBDD4058A7D54677061796C6F61645833F44D0A5E7B9A76F7BC2ABC9C5F7837494025A44466BAFE2873B6050E2FAF93244C835D00C0F6BC7AC2622900D8DE04376384496776657273696F6E016870726F746F636F6C64736E69666A656E6372797074696F6EA36473616C7450000102030405060708090A0B0C0D0E0F656E6F6E63654C101112131415161718191A1B69616C676F726974686D6B70617373776F72642D76316B636F6D7072657373696F6E646E6F6E65"
      }
    }
  ]
}
