{
  "id": "transaction-verification-v1",
  "provenance": {
    "source": "@nemnesia/symbol-sdk compatibility vectors",
    "sourceCommit": "5b085ce011cbe4ab3080286660f2b4360760c868",
    "derivation": "Existing SDK compatibility vectors are copied verbatim. NEM CosignatureV1 was constructed from the fixed fields below and checked against the independent NEM binary field order and sizes."
  },
  "constants": { "privateKey": "1111111111111111111111111111111111111111111111111111111111111111" },
  "cases": [
    {
      "id": "symbol-transaction",
      "input": {
        "sourceTest": "SymbolFacade SDK compatibility transaction signing",
        "unsignedPayload": "BF00000000000000000000000000000000000000000000000000000000000000000000000000000000000000000000000000000000000000000000000000000000000000000000D04AB232742BB4AB3A1368BD4615E4E6D0224AB71A016BAF8520A332C977873700000000016854419C4A00000000000067EDC645230000006887C68BB54134420761157A98AC2D4DF03B761D4ADC6ACC0F00010000000000EEAFF441BA994BE720D61300000000000048656C6C6F2C2053796D626F6C21"
      },
      "expected": {
        "signature": "E54CDB87E3D0BC29C0990FDD9CE502E0E2E75A26D3041E84E82711532C410639DF5A04F84C703A4B7B368F49A50C4232DF6CFAC97978674A177D96A1483E7403",
        "signedPayload": "BF00000000000000E54CDB87E3D0BC29C0990FDD9CE502E0E2E75A26D3041E84E82711532C410639DF5A04F84C703A4B7B368F49A50C4232DF6CFAC97978674A177D96A1483E7403D04AB232742BB4AB3A1368BD4615E4E6D0224AB71A016BAF8520A332C977873700000000016854419C4A00000000000067EDC645230000006887C68BB54134420761157A98AC2D4DF03B761D4ADC6ACC0F00010000000000EEAFF441BA994BE720D61300000000000048656C6C6F2C2053796D626F6C21",
        "result": "verified"
      }
    },
    {
      "id": "nem-transaction",
      "input": {
        "sourceTest": "NemFacade SDK compatibility transaction signing",
        "unsignedPayload": "0101000001000098FB54401420000000E59EF184A612D4C3C4D89B5950EB57262C69862B2F96E59C5043BF41765C482F40000000000000000000000000000000000000000000000000000000000000000000000000000000000000000000000000000000000000000000000000000000000000000F0490200000000001B71401428000000544343334A4434365359343354554E463755534C4C5242345655445A5A4847365145414748434A4640420F000000000032000000010000002A000000E5889DE38281E381A6E381AEE8BBA2E98081E38388E383A9E383B3E382B6E382AFE382B7E383A7E383B3"
      },
      "expected": {
        "transactionHash": "470EA747F15D89E7F946E725B96F8309193C3BEBE6F01168266C9E49D1BA6C4D",
        "signature": "840AEF168DB575622CEACDFC4C399032E98475EB4BB98B12D45219B66FCADD22D93523170D7BB3C9B970F1F5B7E7E70AD96180B6A6971D13A1411C5AF1B3680B",
        "signedPayload": "0101000001000098FB54401420000000E59EF184A612D4C3C4D89B5950EB57262C69862B2F96E59C5043BF41765C482F4000000840AEF168DB575622CEACDFC4C399032E98475EB4BB98B12D45219B66FCADD22D93523170D7BB3C9B970F1F5B7E7E70AD96180B6A6971D13A1411C5AF1B3680BF0490200000000001B71401428000000544343334A4434365359343354554E463755534C4C5242345655445A5A4847365145414748434A4640420F000000000032000000010000002A000000E5889DE38281E381A6E381AEE8BBA2E98081E38388E383A9E383B3E382B6E382AFE382B7E383A7E383B3",
        "result": "verified"
      }
    },
    {
      "id": "symbol-cosignature",
      "input": {
        "sourceTest": "SymbolFacade SDK compatibility cosignature",
        "aggregatePayload": "0801000000000000B749DE6BDBC65083D4C31FC6F1BF296AC31CE8A69758804D3D9C83EAD044856A7359CCD5B33AEE4872049225477A0B1407828DA79E213B27650231E996F74205D04AB232742BB4AB3A1368BD4615E4E6D0224AB71A016BAF8520A332C97787370000000002684142C08F000000000000D53BD545230000007A1801B2EEB095EAC6703CF90A640E0D5FF7E9A7ED410915EFA9A7954923043160000000000000006000000000000000A09AA5F47A6759802FF955F8DC2D2A14A5C99D23BE97F864127FF9383455A4F0000000000168544168AD8BAAB80B1DC684542EC175259711AB2C41D2FEA8D50F0000010000000000EEAFF441BA994BE7081BF40500000000"
      },
      "expected": {
        "parentHash": "509B869153D57C3DFF60B8AFF29DB4841E5CC48ACA6EB24A33B899FADB244C35",
        "serializedCosignature": "0000000000000000A09AA5F47A6759802FF955F8DC2D2A14A5C99D23BE97F864127FF9383455A4F070C1D49C7A480D399AF597059076E6DF33536427F0FE456AFCD61AAD2F9CF478DF330364ACC8C3C49F0FB63240C3780C50ED255241881C86EA73D3A28764690090406699ED7CE26870F1B8E287A74552A604EC62B62EF53BA907D3808753B897",
        "result": "verified"
      }
    },
    {
      "id": "nem-cosignature-v1",
      "input": {
        "privateKey": "2222222222222222222222222222222222222222222222222222222222222222",
        "otherTransactionHash": "00112233445566778899AABBCCDDEEFF00112233445566778899AABBCCDDEEFF",
        "multisigAccountAddress": "NBRZWXOVWSKQNVWJNNI3H72WLKMFCLN33OFJPAEL",
        "timestamp": 1735689600,
        "deadline": 1735690200,
        "fee": "3000000"
      },
      "expected": {
        "publicKey": "654B7BA4C1E7CB30A6C2EE3A4828C407C13D21DFDBCF806EE35F20797134A6C2",
        "signature": "E2ED11A4FC7A9C52003B22C01F81AF03CB7BB44AFC1BC563F114EB4879F32B2A4CB49BAD1F6A197CAADE887D0338D688726AAA53140154172C0A4C2C84E4E505",
        "signedPayload": "02100000010000688085746720000000654B7BA4C1E7CB30A6C2EE3A4828C407C13D21DFDBCF806EE35F20797134A6C240000000E2ED11A4FC7A9C52003B22C01F81AF03CB7BB44AFC1BC563F114EB4879F32B2A4CB49BAD1F6A197CAADE887D0338D688726AAA53140154172C0A4C2C84E4E505C0C62D0000000000D8877467240000002000000000112233445566778899AABBCCDDEEFF00112233445566778899AABBCCDDEEFF280000004E42525A57584F5657534B514E56574A4E4E4933483732574C4B4D46434C4E33334F464A5041454C",
        "result": "verified"
      }
    },
    {
      "id": "body-tamper",
      "input": { "baseCase": "symbol-transaction", "mutation": "transaction-body" },
      "expected": { "error": "verification-failed" }
    },
    {
      "id": "signature-tamper",
      "input": { "baseCase": "nem-transaction", "mutation": "signature-bit-0" },
      "expected": { "error": "verification-failed" }
    },
    {
      "id": "signer-tamper",
      "input": { "baseCase": "symbol-cosignature", "mutation": "signer-public-key" },
      "expected": { "error": "verification-failed" }
    }
  ]
}
